{
    "default_layer_source_directory": "/layer",
    "common_instructions_pre": [
        "RUN pip3 install --upgrade pip",
        "WORKDIR /layer"
    ],
    "common_instructions_post": [
        "RUN pip freeze --path . > requirements.txt"
    ],
    "runtimes": {
        "python3.6": {
            "default_image": "public.ecr.aws/lambda/python:3.6",
            "default_layer_target_directory": "/python/lib/python3.6/site-packages",
            "versions": {
                "1.1.5": {
                    "common_instructions_pre": [
                        "RUN pip install pandas==1.1.5 --target ."
                    ],
                    "architectures": {
                        "x86_64": {},
                        "arm64": {}
                    }
                }
            }
        },
        "python3.7": {
            "default_image": "public.ecr.aws/lambda/python:3.7",
            "default_layer_target_directory": "/python/lib/python3.7/site-packages",
            "versions": {
                "1.3.5": {
                    "common_instructions_pre": [
                        "RUN pip install pandas==1.3.5 --target ."
                    ],
                    "architectures": {
                        "x86_64": {},
                        "arm64": {}
                    }
                }
            }
        },
        "python3.8": {
            "default_image": "public.ecr.aws/lambda/python:3.8",
            "default_layer_target_directory": "/python/lib/python3.8/site-packages",
            "versions": {
                "1.4.2": {
                    "common_instructions_pre": [
                        "RUN pip install pandas==1.4.2 --target ."
                    ],
                    "architectures": {
                        "x86_64": {},
                        "arm64": {}
                    }
                }
            }
        },
        "python3.9": {
            "default_image": "public.ecr.aws/lambda/python:3.9",
            "default_layer_target_directory": "/python/lib/python3.9/site-packages",
            "versions": {
                "1.4.2": {
                    "common_instructions_pre": [
                        "RUNS pip install pandas==1.4.2 --target ."
                    ],
                    "architectures": {
                        "x86_64": {},
                        "arm64": {}
                    }
                }
            }
        }
    }
}